{
 "id": "matrix-wilderness-lost-encounter",
 "name": "Wilderness Lost / Encounter Chances",
 "system": "openfrp74",
 "die": "d6",
 "row_axis": "check",
 "col_axis": "terrain",
 "columns": [
  "Clear",
  "Woods",
  "River",
  "Swamp",
  "Mtns.",
  "Desert",
  "City"
 ],
 "rows": [
  {
   "label": "Lost",
   "sublabel": null,
   "cells": [
    "1",
    "1-2",
    "1",
    "1-3",
    "1-2",
    "1-3",
    "---"
   ],
   "note": "cities: never lost"
  },
  {
   "label": "Encounter",
   "sublabel": null,
   "cells": [
    "6",
    "5-6",
    "5-6",
    "4-6",
    "4-6",
    "5-6",
    "6 (errata)"
   ],
   "note": "City encounter on a 6 per errata (ir-a10)"
  }
 ],
 "usage": "Roll d6 per day per check; band = it happens.",
 "footnotes": [],
 "interpretation_records": [
  "ir-a10-city-encounter-column"
 ],
 "source": {
  "work": "OpenFRP74",
  "booklet": "v3",
  "page": "p18",
  "blocks": [
   2
  ],
  "content_sha256": [
   "ad048e5c5f98d2528ec29586e4640870693f8417abce9fa92acbe98c43a5211b"
  ]
 },
 "extraction": {
  "date": "2026-07-17",
  "model": "claude-opus-4-8",
  "notes": null
 }
}
