{
 "id": "matrix-saving-throws",
 "name": "Saving Throw Matrix",
 "system": "openfrp74",
 "die": "d20",
 "row_axis": "class & level band",
 "col_axis": "attack form",
 "columns": [
  "Death Ray or Poison",
  "All Wands — Including Polymorph or Paralyzation",
  "Stone",
  "Dragon Breath",
  "Staves & Spells"
 ],
 "rows": [
  {
   "label": "Fighting-Men",
   "sublabel": "1-3",
   "cells": [
    "12",
    "13",
    "14",
    "15",
    "16"
   ],
   "note": null
  },
  {
   "label": "Magic-User",
   "sublabel": "1-5",
   "cells": [
    "13",
    "14",
    "13",
    "16",
    "15"
   ],
   "note": null
  },
  {
   "label": "Cleric",
   "sublabel": "1-4",
   "cells": [
    "11",
    "12",
    "14",
    "16",
    "15"
   ],
   "note": null
  },
  {
   "label": "Fighter",
   "sublabel": "4-6",
   "cells": [
    "10",
    "11",
    "12",
    "13",
    "14"
   ],
   "note": null
  },
  {
   "label": "Magic-User",
   "sublabel": "6-10",
   "cells": [
    "11",
    "12",
    "11",
    "14",
    "12"
   ],
   "note": null
  },
  {
   "label": "Cleric",
   "sublabel": "5-8",
   "cells": [
    "9",
    "10",
    "12",
    "14",
    "12"
   ],
   "note": null
  },
  {
   "label": "Fighter",
   "sublabel": "7-9",
   "cells": [
    "8",
    "9",
    "10",
    "10",
    "12"
   ],
   "note": null
  },
  {
   "label": "Magic-User",
   "sublabel": "11-15",
   "cells": [
    "8",
    "9",
    "8",
    "11",
    "8"
   ],
   "note": null
  },
  {
   "label": "Cleric",
   "sublabel": "9-12",
   "cells": [
    "6",
    "7",
    "9",
    "11",
    "9"
   ],
   "note": null
  },
  {
   "label": "Fighter",
   "sublabel": "10-12",
   "cells": [
    "6",
    "7",
    "8",
    "8",
    "10"
   ],
   "note": null
  },
  {
   "label": "Magic-User",
   "sublabel": "16+",
   "cells": [
    "5",
    "6",
    "5",
    "8",
    "3"
   ],
   "note": null
  },
  {
   "label": "Cleric",
   "sublabel": "13+",
   "cells": [
    "3",
    "5",
    "7",
    "8",
    "7"
   ],
   "note": null
  },
  {
   "label": "Fighter",
   "sublabel": "13+",
   "cells": [
    "4",
    "5",
    "5",
    "5",
    "8"
   ],
   "note": null
  }
 ],
 "usage": "Roll d20 ≥ cell: no effect from death ray/polymorph/paralyzation/stone/spell, or half damage from breath and the like; under it, full effect. Dwarves and Hobbits save four levels above their actual level.",
 "footnotes": [],
 "interpretation_records": [],
 "source": {
  "work": "OpenFRP74",
  "booklet": "v1",
  "page": "p20",
  "blocks": [
   4,
   5,
   6
  ],
  "content_sha256": [
   "03d64f0cdacf31791ecca75a70eb50c7fa1bdd1cec640ababdaaea83574141b9",
   "cf56e9e49402499495c386ee699d3f15ebdffa6aebf1c145980d941fcd640d7d",
   "5233a41f874fbe1d13ea3dc26d10a25bb5ce19c27c58def584c2dba721d86b95"
  ]
 },
 "extraction": {
  "date": "2026-07-17",
  "model": "claude-opus-4-8",
  "notes": null
 }
}
